{
  "$schema": "http://json-schema.org/draft-07/schema#",
  "title": "LevelData",
  "description": "Schema for one level file under Assets/Resources/Levels. Mirrors Scripts/Data/LevelData.cs field-for-field.",
  "type": "object",
  "required": [
    "levelId",
    "worldId",
    "title",
    "topic",
    "difficulty",
    "questionType",
    "story",
    "question",
    "starterCode",
    "expectedAnswer",
    "hints",
    "xpReward"
  ],
  "properties": {
    "levelId": {
      "type": "integer",
      "description": "Unique level identifier, used for unlock/progress tracking."
    },
    "worldId": {
      "type": "integer",
      "description": "World this level belongs to."
    },
    "title": {
      "type": "string",
      "description": "Level name shown in the World Map and Level Scene header."
    },
    "topic": {
      "type": "string",
      "description": "C# concept taught, e.g. bool, if."
    },
    "difficulty": {
      "type": "integer",
      "minimum": 1
    },
    "questionType": {
      "type": "string",
      "enum": ["FillCode", "CodeOrder", "Debug", "OutputPrediction", "Coding"]
    },
    "story": {
      "type": "string",
      "description": "Narrative shown before the mission."
    },
    "question": {
      "type": "string",
      "description": "The task the player must solve."
    },
    "starterCode": {
      "type": "string",
      "description": "Code pre-filled in the Code Input box. May be empty."
    },
    "expectedAnswer": {
      "type": "string",
      "description": "Reference answer used by JudgeManager (Phase 2)."
    },
    "hints": {
      "type": "array",
      "items": { "type": "string" },
      "maxItems": 3,
      "description": "Up to 3 hints, ordered from vaguest to most direct."
    },
    "xpReward": {
      "type": "integer",
      "minimum": 0
    }
  }
}
